{
  "event_type": "activity_result",
  "event_version": "1.0",
  "student": {
    "student_id": "u123",
    "session_id": "sess_001"
  },
  "context": {
    "topic_id": "t_derivadas",
    "skill_ids": [
      "k_regla_potencia"
    ],
    "language": "es",
    "mode": "practice"
  },
  "activity": {
    "activity_id": "act_0002",
    "item_id": "itm_002",
    "item_format": "mcq",
    "difficulty_label": "media",
    "seed": 12345
  },
  "response": {
    "is_correct": true,
    "selected_option": "B",
    "attempts_count": 1,
    "hint_used": false,
    "hints_count": 0,
    "response_time_ms": 18300
  },
  "telemetry": {
    "started_at": "2025-12-13T18:40:00-05:00",
    "ended_at": "2025-12-13T18:40:18-05:00",
    "client_device": "web",
    "client_version": "simulator_stub_0.1"
  }
}